Company Name,About,Logo
Marketing za sve,Digital marketing company from Split (Croatia). Specialized in web design and web page optimization for search engines also offer online digital marketing education.,https://static.semrush.com/agency-directory/uploads/images/65/6556407f-4c26-4f55-891f-69733b61092d.png

Mediabirds,"We are a full-service digital agency based in Amsterdam. We combine creativity, expertise and strategy to make a real impact on your target audience.",https://static.semrush.com/agency-directory/uploads/images/0c/0c781c7e-12d7-434c-beff-a5623556695a.png

ARC Creative Co.,"Voted ""Best of"" Marketing Agency in Campbell & Sunnyvale, CA. We help you get seen on Google through ads and SEO. View our case studies to see how to consistently outrank and outperform competitors. Call (408) 475-1604 or visit",https://static.semrush.com/agency-directory/uploads/images/f2/f2dd974f-09c6-4711-8f7a-3900a0975c72.png

CodeMasters Agency,CodeMasters Agency gives endless solutions to businesses who want to build and expand their online presence. Customer satifaction is our number 1 priority. We strive to exceed the expectations of even our most demanding clients.,https://static.semrush.com/agency-directory/uploads/images/ba/ba60c623-cc5d-4050-8f5a-985d113fe94d.jpg

1827 Marketing,"1827 Marketing simplifies and streamlines your digital B2B marketing. We are a digital marketing agency with the talent, expertise and technology platforms for B2B content marketing, marketing automation & customer experiences that deliver results.",https://static.semrush.com/agency-directory/uploads/images/f0/f0f5eb57-a349-43a8-8588-a301f7c5a6b1.png

Mage H.D.,Magehd was established in 2016 by a dynamic duo with 20+ years of experience in the industry. We focus on what brings you a return on investment with use of an organized internet strategy. A high quality final product and following industry standard ,https://static.semrush.com/agency-directory/uploads/images/3c/3ca1c816-22d8-42d7-bed8-0c1a2d32d6ff.png

NRG Digital Solutions,"We're a solution-first agency revolutionizing how companies market, sell & service their customers. We have a passion for Web Development, SEO, Paid Ads, Branding & Social Media - but we’re capable of doing a lot more. Find out on our agency page.",https://static.semrush.com/agency-directory/uploads/images/e8/e8aa5983-3e2d-4f1c-8b39-613e1d85f2c3.png

Relevant Marketing & Events,We provide the wide range of high quality creative marketing and best practices solutions to our customers making their business better.,https://static.semrush.com/agency-directory/uploads/images/32/32b69abf-862b-4e81-99ed-d697a2e50865.jpg

GrowSmart,Supercharge Your Growth With A Creative Team Behind You! ROI Results Based Innovative Marketing. GrowSmart is a full-service digital marketing partner that analyzes your needs and concerns and creates an impactful digital presence by adding fluidity ,https://static.semrush.com/agency-directory/uploads/images/a5/a5753e49-bda0-40c8-aebf-8423618d588f.png

Sugoi,"A boutique digital marketing agency that focuses on organic growth. We handle social media marketing, SEO, and content creation for individuals, brands, and companies to increase sales, leads, and exposure. ",https://static.semrush.com/agency-directory/uploads/images/5f/5fe987f4-5205-4219-ba48-18a2f97f3bc1.jpeg

Petrikor Solutions,"As a marketing agency that specializes in content creation, design, animation, mobile application design and development, website design and development, digital marketing (SEO & SEM ), and social media marketing, we act as your bespoke ",https://static.semrush.com/agency-directory/uploads/images/ce/cec4a970-4ca4-4f81-ab7a-fa4a730582d2.png

OH Marketing Group,OH Marketing Group is a hybrid consulting and marketing services firm that provides strategic leadership and experts to execute challenging marketing tasks on-demand for small to mid-size companies through to larger corporations. Scaling a company ,https://static.semrush.com/agency-directory/uploads/images/d2/d2d4d5cc-1e7e-4fc0-979f-87fc193b0733.png

kw communications,"Wir unterstützen Sie, im Web nachhaltig sichtbar und vielseitig auffindbar zu werden. Und zeigen Ihnen dabei, wie Sie ihre Webseite, Webshop und/oder Social-Media-Präsenz in eine Marketing- und Verkaufsmaschine verwandeln. Als 360° Digitalagentur ",https://static.semrush.com/agency-directory/uploads/images/5d/5da5fc81-b57b-45a4-b455-552261637c9f.jpg

Avirasphere,Avirasphere is a full service digital marketing agency that helps local businesses address the challenges they face online and in the marketplace.,https://static.semrush.com/agency-directory/uploads/images/5b/5b6f5251-154b-4745-9b75-c12d76bc1425.png

Club Creative,"Formerly known as CRoche Consulting, we are a full-service marketing consulting firm located in the Oklahoma City/Edmond area that serves clients around the entire United States. Our focus is cost-effective, high-performance marketing.",https://static.semrush.com/agency-directory/uploads/images/45/4557afbf-98e6-4ffb-a4b5-abc7cdc07cbc.png

Launch Studios,"Launch Studios is a leading digital marketing agency based in Austin, Texas. We help businesses grow with search, social media, and email campaigns that generate interest, sales, and leads through our proven custom marketing solutions, refined over ",https://static.semrush.com/agency-directory/uploads/images/63/631d01d1-ce0d-45ae-8b42-00896b00800f.jpg

Kotton Grammer Media,"Serving over +2500 clients over the last 10 years, We help businesses and individuals get found in Organic Search ",https://static.semrush.com/agency-directory/uploads/images/25/25c261cd-f9c9-41e5-952b-c9ff8ce4dbe1.png

TOB Business Solutions,"Von Strategieentwicklung bis hin zur Implementierung, mit Fokus auf lokale KMU helfen wir Ihnen dabei gefunden zu werden.",https://static.semrush.com/agency-directory/uploads/images/b9/b9a5fc66-d2fe-4ef0-8bf8-f88059e06d7b.png

Juggernaut Digital Marketing,"Juggernaut™ is a digital marketing agency that partners with our clients to do one thing: Build. Scale. DOMINATE. If this sounds like what you want to do in your industry, we'd love to hear from you.",https://static.semrush.com/agency-directory/uploads/images/e5/e5a4ccb9-4708-44de-b414-e9d815c27520.jpg

SEOBRO.Agency,"We are SEO experts with over 15 years of experience. We are here to take the hassle out of SEO. By solving any SEO problems you may be having, we help you finally start getting leads and sales through your website.",https://static.semrush.com/agency-directory/uploads/images/90/9072ed3e-9daa-4161-8f1f-db4331e9e120.png

Devhaus Pte Ltd,"Devhaus Digital Transformation Services help companies adopt the best technology in their digital transformation journey - working alongside startups, scaleups and small to medium sized enterprises in structuring the right automation, communication ",https://static.semrush.com/agency-directory/uploads/images/4f/4fd8890a-9cdd-4d8a-855a-18176e49d59f.png

"Aardvark Communications, Inc","Aardvark Communications is dedicated to meeting the unique needs of each client. Since 1992, we've developed and implemented innovative and successful public relations and marketing programs for a broad range of clients. We measure our ",https://static.semrush.com/agency-directory/uploads/images/f5/f5f8f412-70a7-4414-b451-a77167dbfe59.png

SEO Assistance,"SEO Assistance is an SEO agency based in Sydney that specialises in SEO. SEO is the only service we offer, and is the channel we put all of our focus on. We work with clients like Wix.com, Sony.com, Canva.com. We've been featured on television and ",https://static.semrush.com/agency-directory/uploads/images/b6/b6a68d48-e21b-4164-8950-96630c8d8f43.png

WILL+WAY LLC,"We're an independent agency focused on content marketing, marketing automation, and digital advertising for B2B companies and tech entrepreneurs. That means we come up with the stuff, make it, and get it in front of your buyers. Our secret sauce is ",https://static.semrush.com/agency-directory/uploads/images/2a/2a43d06c-6faf-4846-a474-c9e035fa9383.png

Gray Line Media,"We help businesses build, scale, and see real results with high-converting websites and effective marketing strategies!",https://static.semrush.com/agency-directory/uploads/images/c5/c5cba9c3-efc4-48ef-84f8-fd988691bd75.png

MonsterClaw LLC,"MonsterClaw is a team of 50+ in-house digital marketing professionals, along with a large remote team working from different parts of the world. MonsterClaw have been working with eCom brands for the last three years across several industries, and ",https://static.semrush.com/agency-directory/uploads/images/09/09f6dac4-0c1d-460a-8fbf-e68d62f584ef.png

INCA MEDIA LTD,"Your Full-Service Digital Marketing Agency! Here at INCA, we provide a well-rounded set of digital marketing services that can help your company thrive. Here is what we can do for you: - Search Engine Optimization (SEO) - PPC (Pay Per Click) - ",https://static.semrush.com/agency-directory/uploads/images/5c/5c0cb12f-cf40-450d-b807-f47c9769eddd.png

TruStar Marketing,"TruStar Marketing provides a range of digital marketing services that fuse the art and science of marketing to improve sales. This is our mission and experience: To improve your marketing results dramatically and measurably, so you can see your ",https://static.semrush.com/agency-directory/uploads/images/55/55283d9d-7613-4ea1-a269-34f6b3992951.png

Ciphers Digital Marketing,Ciphers Digital voted the #1 Digital Marketing Agency in Arizona. From local SEO to fully strategized organic SEO & long-term online marketing campaigns. We implement the full stack experience by providing search engine optimization and complete ,https://static.semrush.com/agency-directory/uploads/images/93/9308be6d-dcb2-48d2-b7f8-770e14664f9b.png

DEA.Amsterdam,"We are DEA.Amsterdam, a boutique agency based in Amsterdam and the go-to agency for Digital Commerce. We are experts in advertising, marketplaces and customer data platforms. We work for commercially driven organisations in retail, travel and ",https://static.semrush.com/agency-directory/uploads/images/c3/c3b6296d-5c6e-4332-a4c6-eae92c7f6465.png

Edify Content,"Edify Content writes blog posts, case studies, newsletters, website copy, books, white papers, online courses, and more. We have 20 years experience in software development, 10 years in marketing, 13 years in software leadership, 4 published books, ",https://static.semrush.com/agency-directory/uploads/images/47/47e3f49d-cbae-4ca3-a181-7a2c99f73932.png

IIIMPACT,Results-based Software design and development agency. We help companies launch better software faster .,https://static.semrush.com/agency-directory/uploads/images/97/97b4688f-15f8-41ed-abc6-1a8632e15cbc.png

Level Up,WE DO IT DIFFERENT! Everyday we manifest unparalleled dedication devoted to creating a strategy tailored to your exact needs. Work until the lights go out. Transparency. Expertise. All traits held by EACH team member hand selected by our founder,https://static.semrush.com/agency-directory/uploads/images/14/1456a155-2e51-46a7-ae16-cf2946cf5b7e.png

Internet Monkeez - Digital Architects,"We are a Growth Marketing Agency and focus purely on your company growth, leaving you to get on with running your business. We provide numerous services that support company growth including Website Design, SEO and Customer Support to name a few.",https://static.semrush.com/agency-directory/uploads/images/25/251bfba3-802b-47d6-9400-730a99de9368.png

The Growth Agency,"We’re your team of data driven marketers & business consultants We help ambitious companies use data in their marketing strategy and create & execute growth experiments to increase their revenue. Our Methodology We conduct experiments, ",https://static.semrush.com/agency-directory/uploads/images/e2/e2641d33-a055-465b-b03d-5cfe7213db46.jpeg

Spark Labs Marketing,"We're a full service marketing company that helps clients and many other industries increase revenue through strategic online strategies. We provide complete digital marketing solutions to businesses to save them time, money, and energy. ‘Spark’ ",https://static.semrush.com/agency-directory/uploads/images/c7/c7f72204-1482-4620-88a9-fcb329a264bf.png

One Stop Media,"Success is defined as achieving business outcomes that are aligned with your objectives. At One Stop Media, we'll show you how you can achieve real results through a data-driven marketing strategy built from the ground up.",https://static.semrush.com/agency-directory/uploads/images/62/626bce39-2b3c-4bd0-b1a5-6079f0e17158.png

Ploomia,"Ploomia, c'è sempre un modo. Siamo l’obiettivo che non hai ancora. La nostra esperienza è digitale, la nostra mentalità è umanista, il nostro metodo è creativo. Le persone? Tutto. Forti di un’esperienza importante nella SEO e nel digital marketing, ",https://static.semrush.com/agency-directory/uploads/images/05/05b064a5-d045-43ba-af7b-81269a2eee49.jpg

The SEO Works,"The SEO Works are an award-winning provider of search marketing, websites and paid social for leading brands and prospering SME’s. We have worked for more than a decade with one key goal in mind - to get businesses more customers online. We pride ",https://static.semrush.com/agency-directory/uploads/images/97/970f5de3-e4ea-4b91-a09c-3d6a888eacf2.png

Eurostep Commerce Srl,"Diamo forma al futuro del mondo commerce costruendo connessioni tra brand, retailers e persone. Il nostro obiettivo, attraverso l’ecommerce, è quello di rendere i nostri clienti player globali in contesti di mercato internazionali sempre più ",https://static.semrush.com/agency-directory/uploads/images/52/52b30bbe-94e4-4017-9a94-eaf932824a2e.png

Advanced Vision IT,"Advanced Vision IT Ltd is a team of IT Experts in different technology domains and Business Professionals who provide very snappy and responsible ICT Services and Solutions in the area of Cybersecurity, Cloud, and Managed technologies.",https://static.semrush.com/agency-directory/uploads/images/85/85984778-98c1-4143-a9f6-fec50f6c37c4.png

Creativus Design,Creativus Design is the leading Digital Marketing agency based in Sydney that provides ROI driven digital marketing services. Our expert digital marketing consultant in Sydney have years of experience and are ready to help you with a tailored ,https://static.semrush.com/agency-directory/uploads/images/00/008ba3ff-96cf-4b72-b2bb-e2c7840ab7cd.png

Relevant Marketing & Events,We provide the wide range of high quality creative marketing and best practices solutions to our customers making their business better.,https://static.semrush.com/agency-directory/uploads/images/32/32b69abf-862b-4e81-99ed-d697a2e50865.jpg

Extera Digital Agency,"Extera è la digital agency che da 20 anni trasforma le aziende attraverso il digitale. La consulenza si unisce ad un ampio team di sviluppo, all’abilità dei marketers e alla creatività dei designer. Il nostro obiettivo è mostrare il reale potere del ",https://static.semrush.com/agency-directory/uploads/images/fc/fc41ad2a-2e9e-4685-8027-ad475344955a.png

HV Media Group,"We’re an independent, strategic results-driven agency focused on delivering ROI for our clients based on their commercial objectives. Our beliefs are that all media should be goal-driven, measurable and 100% accountable to your business success. If",https://static.semrush.com/agency-directory/uploads/images/ae/aea3cff4-bc87-4d67-89d7-9b32e61fe26e.png

Intygrate,"Intygrate is an ERP consulting firm offering custom solutions to enhance business processes, specialising in e-commerce. We use cutting-edge cloud tech and are a gold sponsor of vue.js.",https://static.semrush.com/agency-directory/uploads/images/b4/b4039a54-ad49-48a2-8e32-06f93636341b.png

Neil Patel Digital,"We provide affordable, full-service marketing and SEO for small businesses. Neil Patel started NPAccel to provide the small business owner with online marketing services that are affordable and effective.",https://static.semrush.com/agency-directory/uploads/images/ba/ba031159-5d5e-450f-9a8d-6e27c9d9d1a0.jpg

Creative Direct Marketing Group,"A leader in target advertising, Creative Direct Marketing Group, Inc is a full- service, direct response advertising and digital marketing agency with one goal in mind: increasing your response, market presence, and profits through “accountable ",https://static.semrush.com/agency-directory/uploads/images/0a/0a9dab16-0914-41fe-afca-24aa61b1af75.png

Solheim Technologies,"Support Businesses Through Technology Management. Website Design, Business Consulting, Marketing and Advertising.",https://static.semrush.com/agency-directory/uploads/images/25/25da18e4-2620-43cf-8216-8542aa02a4db.png

The Sailboat Agency,"Our team at The Sailboat Agency will act your internal marketing team, from researching your market, to developing a personalized strategy optimized for your business needs, to final and on-going execution.",https://static.semrush.com/agency-directory/uploads/images/8b/8bc01d21-1021-4558-ab7e-853d8090dc17.png

"Loon Call Media, LLC",Holistic Search Freelancer with over 8 years of experience including Big 4 Agency and in-house at some of the largest budgets in PPC. Expertise in developing strategies for long-tail lead-gen and customer relationship management.,https://static.semrush.com/agency-directory/uploads/images/05/05541778-3143-4fb1-a736-5d9a0879b9d0.jpg

The Accidental SEO,"An Integrated Marketing Strategy & Accidental SEO agency. Starting with a core base in SEO Optimsation, we have since branched out into Multichannel Planning, Audience Analysis, Media Buying and Performance Reviews.",https://static.semrush.com/agency-directory/uploads/images/53/530fc0bb-dbec-482a-a646-63b57480b37b.png

SearchMax,"With a decade of experience under our belt, SearchMax is helping businesses reach their fullest potential. As a Google Premier Partner & the top 3% of Google agencies in Australia, we've been crafting winning digital strategies for 10+ years!",https://static.semrush.com/agency-directory/uploads/images/cf/cf62637f-1d04-4884-bdf1-aa46325fa1e9.jpeg

Mission Catnip Marketing,"We're a down-to-earth marketing team with a passion for helping small business owners achieve success by providing comprehensive, customized marketing plans.",https://static.semrush.com/agency-directory/uploads/images/08/085f5570-da67-45f1-82ec-afa65d2f432b.png

Bridge Media,Bridge Media is a bilingual online marketing agency based in Quebec. We specialize in SEO and SEM for service and ecommerce businesses with 2 - 20 employees. We've developed tactics over the years to help our customers rank and maximize their ROI.,https://static.semrush.com/agency-directory/uploads/images/8d/8d57718b-d6f6-4ce3-9d3d-da846a2cd9af.png

Ursa Star Media,Small business is our main passion. Here is why... It is very fulfilling for us to see a smile on your face and how your life becomes easier and easier every time we optimize your business and grow your customer base.,https://static.semrush.com/agency-directory/uploads/images/31/3105eaf2-1e28-430e-b542-9dffa91ca04d.png

Stubborn Marketing,"Our Subscription Marketing Agency will design, host, create, and manage all of your digital marketing for $999 a month, no contracts",https://static.semrush.com/agency-directory/uploads/images/69/6952c1be-35c3-4b68-b53d-58607e999641.png

D Koder Marketing,Hire a performance based marketing agency the builds your brand without term contracts and we agree to work with you; not your competitors.,https://static.semrush.com/agency-directory/uploads/images/19/1900d9d5-18ef-47eb-9d47-e8d27262b216.png

"Revenue Surge, Inc.","When it comes to website design Revenue Surge is by far the industry leader in the field. We’ve created, tested and analyzed thousands of web sites, to develop a wealth of knowledge that allows us to maximize our client’s campaign ROI.",https://static.semrush.com/agency-directory/uploads/images/4b/4bd2828e-66b6-4712-8545-69c7ae38d396.png

Alpha Key Digital,"Alpha Key Digital is the leading industry expert in digital marketing, creating online assets for businesses seeking to bridge the gap between traditional and cutting edge digital marketing.",https://static.semrush.com/agency-directory/uploads/images/1a/1a7f1ec8-6a70-4435-95e3-fc4b9ebd7c85.png

WebHunter,"We are a UK based web design & marketing agency specialising in highly effective websites, web marketing and support services for small and medium sized companies. Our ability to design, develop, maintain, and promote websites stems from a ",https://static.semrush.com/agency-directory/uploads/images/38/38f45208-4049-462b-a6fd-d11c7ef45961.png

D-DAT SEO Consultancy,Propel your business to new heights with our digital marketing services and technology platform. We focus on the bigger picture. D-Dat team and goals has been designed to help clients make smarter marketing decisions using tools like Google ,https://static.semrush.com/agency-directory/uploads/images/ce/ce7674e7-46b4-47d7-b1b6-b2c7c9347e1b.jpeg

"UP Market Media, Inc.","A full-service marketing agency focusing on digital advertising solutions. Services: Website Design, Hosting, Search Engine Optimization, Graphic Design, Social Media Management, Google Ads Management, Programmatic and more. Schedule your ",https://static.semrush.com/agency-directory/uploads/images/d5/d545fb10-3914-42e4-9f98-968a1a495773.png

Shared Audiences,"Shared Audiences specializes in paid social advertising (Facebook, Instagram, LinkedIn, TikTok, Twitter Ads), search engine marketing (Google and Microsoft Ads), search engine optimization (SEO), and social media marketing. We were founded by Will ",https://static.semrush.com/agency-directory/uploads/images/74/749775db-b659-4784-a393-9152a0c60b8b.png

WOW Dental Marketing,Dental marketing and lead generation that actually generates new patients. Empowering smart ambitious principal dentists’ to generate up to 100 new patients a month even if they work in highly competitive locations. ,https://static.semrush.com/agency-directory/uploads/images/9c/9c2d7722-a19e-48d9-aea2-7a49e758a222.png

Groon Srl,GROON è un’agenzia di comunicazione orientata al digital dove le PERSONE vengono prima dei PROGETTI. Curiamo le relazioni personali a cui affianchiamo COMPETENZE maturate in anni di esperienze anche molto differenti. Siamo specializzati nel settore ,https://static.semrush.com/agency-directory/uploads/images/63/6388603b-7b45-413a-b4a8-2fab60dde626.png

Coalition Technologies,Coalition Technologies is one of the leading SEO and web design & development agencies in the United States. We have over 700+ case studies on ecommerce and lead generation B2C and B2B clients across several industries. Our company has grown to ,https://static.semrush.com/agency-directory/uploads/images/42/423674af-6712-47bf-a1b3-b4660f6808e3.png

Zamerat Digital Marketing,"Zamerat is your one-stop shop for digital growth, offering everything from stunning websites and high-converting landing pages to effective digital strategies, and precisely targeted advertising campaigns. We can transform your vision into a ",https://static.semrush.com/agency-directory/uploads/images/1e/1e26bbdd-fba0-4e37-8af0-f48130ee18c0.png

Webhoster.ca,"Webhoster.ca provides engaging digital marketing and reliable web solution services. Trusted, for over 20 years, our focus remains on helping businesses improve brand awareness, generate leads, and increase online sales.",https://static.semrush.com/agency-directory/uploads/images/de/de701592-d5e0-4992-862a-946ddba280c3.jpg

GRIT Media,"We are a digital marketing agency. Our core values are passionate, personal and credible. And we live by the motto ""works like an agency, feels like a colleague."" Our eleven digital specialists work on a daily basis with analysis, insight and ",https://static.semrush.com/agency-directory/uploads/images/00/00fc12c4-be3a-412b-83f3-bfa2ea43be36.png

Alchemy Interactive Web Agency,"Award winning web agency that delivers websites that work in every sense. From strategy through to to usability, to traffic, to conversion - we know what works and how important it is to deliver working websites. SEO is built in from the ground up ",https://static.semrush.com/agency-directory/uploads/images/fa/fa1eacc9-eb15-42b9-9526-bd32f9009b38.png

Manning & Co.,"Manning & Co. is a regional, full-service strategic marketing consultancy providing integrated brand, PR, marketing and creative services. We’re passionate about providing integrated and holistic services that deliver real value to clients. To ",https://static.semrush.com/agency-directory/uploads/images/b4/b42cd4d1-9610-470f-97fc-311dc117991e.jpg

Upthrust,"We implement growth marketing processes & build high-performing digital products for ambitious SMEs and big corporates, while training your internal teams on the process and tactics we use. We staff & train digital experts, give your ",https://static.semrush.com/agency-directory/uploads/images/68/686cae2a-097b-49f2-8640-b790c09c2643.png

MIAX Digital branding agency Amsterdam,"MIAX is a strategic digital agency based in Amsterdam. We develop strong brands and effective digital marketing campaigns for start-ups and scale ups. Our approach is focused on objectives and measurable results. In our work, everything revolves ",https://static.semrush.com/agency-directory/uploads/images/16/16267fb3-a596-434d-9e2b-787ee8bb7213.jpg

Root & Roam Integrated Marketing Agency,We are a full-service marketing agency with the creative skills and analytical knowledge that will define your brand and develop strategies with measurable results. It may be a digital world but it’s the human connection that builds trust. We don’t ,https://static.semrush.com/agency-directory/uploads/images/b7/b76e5c7d-8b37-4514-a76d-ce48b5ca2c49.png

