Company Name,About,Logo

Rank Sinatra SEO,Rank Sinatra - Austin SEO and digital marketing agency specializing in ranking your business higher in Google Search results and Amazon.,https://static.semrush.com/agency-directory/uploads/images/35/35827e63-a1cc-4c8c-980e-fbd81014dd13.png

Marketing Optimised,"Digital Marketing consultant that specialises in SEO, PPC brand management and business development.",https://static.semrush.com/agency-directory/uploads/images/f0/f0592802-ef5b-4dd0-ad58-6b954715af45.png

Go Hamm Digital Marketing LLC,"Go Hamm Digital Agency is a full service digital marketing agency. We are an agency focused on developing advanced SEO strategies for small and medium sized companies. But with a multi-faceted team, we offer a data informed approach to marketing.",https://static.semrush.com/agency-directory/uploads/images/8f/8f10b7f3-1f8c-4549-a444-64b0a817d37b.png

Toot Marketing,Toot Marketing is a customer-centric agency offering full-service SEO & PPC services. We take a holistic view to your digital marketing processes using industry-leading insights. We work with clients from start-up to multi-national scale ,https://static.semrush.com/agency-directory/uploads/images/85/850589b7-2d69-45f9-98df-ade44896d186.png

Loaded Media,"Rating in the 80s for Domain Authority - Loaded Media is a top-rated SEO, Web Development, and Public Relations Agency. Their publishing division operates 12 magazines. Their clients range from small businesses to billion-dollar corporations.",https://static.semrush.com/agency-directory/uploads/images/f2/f24a9ad1-b650-40eb-9ebb-142645277082.png

Big Rock Marketing,Big Rock Marketing is a digital marketing agency that specializes in SEO & content marketing for small and medium local businesses. We work every day to help businesses grow their revenue online.,https://static.semrush.com/agency-directory/uploads/images/bc/bc484242-ec2a-4a70-bee0-96d08fde3734.png

Marketing Empire Group,Marketing Empire Group is an ideal partner for small to medium-sized businesses that are looking for comprehensive marketing solutions. We act as your CMO so you can focus on the most impactful parts of running your business.,https://static.semrush.com/agency-directory/uploads/images/44/4494c33e-931a-41db-8989-8f8fc823b48b.png

Peyton Ave Corporation,"Business to Business Digital Marketing. Search Engine Optimization, Google Ads, Bing Ads, Social Media Management, Content Development, Consulting, Reporting, Analytics, SEMRush Tools. 15 Years of Experience.",https://static.semrush.com/agency-directory/uploads/images/00/002fe8d1-2d47-4368-a604-da76568653a7.png

Calibre9,"At Calibre9, we are a specialist agency, focused purely on SEO to deliver high performing campaigns for businesses online.",https://static.semrush.com/agency-directory/uploads/images/d1/d14c32be-7eea-41b1-b1df-5da080ab9b6b.jpg

Visionary Web Solutions LLC,A concise team built of experts with various industry backgrounds to help make sure your business has the right approach to grow effectively.,https://static.semrush.com/agency-directory/uploads/images/2e/2e11584a-0e8d-4d57-80f5-997c4808fc3c.jpg

Artic Agency,"Agencia de Marketing Digital 360º basada en Barcelona y el Penedès. Expertos en posicionamiento web, estrategias de crecimiento y conversiones. Nos encargamos de toda la parte digital de las empresas para que no tengan que preocuparse de nada.",https://static.semrush.com/agency-directory/uploads/images/54/54ea2af0-d344-4252-9c71-73023713b46a.png

Rough Works,"Take Your Vision From Rough to Refined. Frontend Development, Backend Development, Web Design, Branding and Digital Marketing. Let Rough Works handle your web project today.",https://static.semrush.com/agency-directory/uploads/images/ea/eadaf731-7eeb-4c07-9fe1-bd60f848b1d8.png

Procab Studio,"Procab Studio is a full-service creative agency based in Geneva, Switzerland that offers a wide range of services to help businesses communicate their message effectively and achieve their goals.",https://static.semrush.com/agency-directory/uploads/images/f0/f029fc40-37d6-4705-8fad-f7a32184bc6f.png

C+J Creative Services,C+J Creative Services offers tailored digital marketing strategies & expert business development services to help businesses attract customers & generate more revenue. We also offer project based creatives services. Contact us to get started today.,https://static.semrush.com/agency-directory/uploads/images/d7/d77ecda8-d5a7-425b-a0ae-f60be0e4b4b2.png

Minabocks,"Minabocks is an Advertising Agency in Cyprus, based in Nicosia. Experienced in delivering advertising on various platforms and mediums in Cyprus, Europe, and the Middle East. We specialize in SEO and Google Ads.",https://static.semrush.com/agency-directory/uploads/images/bb/bbf9675c-4ac8-42c7-9fb0-7b2b4da31293.png

Bakklog,"We’ve helped more than 400 service-based businesses generate over $200,000,000 in sales through our expertise in SEO. Will yours be next?",https://static.semrush.com/agency-directory/uploads/images/77/776a1f92-f504-4fde-9700-0d8e92d8945e.png

RedShift,"At RedShift, we believe that nothing is more important than a results-driven digital marketing game plan that simplifies, strengthens and brings scalability to your business. We founded Digital Marketing Essentialism™ to break the status quo, ",https://static.semrush.com/agency-directory/uploads/images/2b/2bb0ef8f-d0fc-4bfb-8199-cb35ab91a28f.jpeg

Imageworks Creative,"Founded in 1997, ImageWorks is an award-winning UX and website design agency, branding firm, and marketing company – all in one. Our hand-picked, industry-leading creative talent is focused on one mission: Your business success. MEET ImageWorks ",https://static.semrush.com/agency-directory/uploads/images/3a/3af60cab-76f8-401f-aa54-941796151269.png

Botpresso,"We at Botpresso are a collective of SEO professionals that have experience from all over the globe, so get in touch with us to get the right kind of consultation to spearhead your organic traffic to new peaks. ",https://static.semrush.com/agency-directory/uploads/images/e9/e9c4439b-de0e-48fe-b369-cca35ca1c828.png

Digital Ink,"Our approach to branding goes deep. We dive into your industry, audience, and competitors before an idea is presented to you. We find the marvelous, then amplify and direct that energy to the audience, using unparalleled storytelling and creativity.",https://static.semrush.com/agency-directory/uploads/images/6c/6c12d227-5226-4b0c-95d2-64b0d2d7ddf2.jpg

YEAHCONCEPT,Wir sind yeahConcept. Full Service Internetagentur & WordPress Agentur. Experte für WordPress Webseiten. Partner für kleine und mittelständische Unternehmen sowie Startups. Wir kümmern uns um Ihre Website damit Sie mehr Zeit für Ihr Unternehmen ,https://static.semrush.com/agency-directory/uploads/images/71/71a13863-a412-435b-b0e9-07d3818fa5e0.jpg

PRAN,"At PRAN, we are more than just a team. We are a family of talented, passionate people working under one roof to provide top-level bespoke digital services to help businesses grow and reach their full potential digitally. Every team member brings a ",https://static.semrush.com/agency-directory/uploads/images/45/45c74e16-d9d6-4d3f-8f36-3f3600b38346.png

SEOHELP.AMSTERDAM,"At Seohelp.Amsterdam, we specialise in providing our clients with expert SEO and PPC services. We ensure that our clients' sites are optimised for SEO to all the latest best practices. We create high-converting PPC campaigns at all levels of the ",https://static.semrush.com/agency-directory/uploads/images/d7/d7fcafba-f16b-446f-8b19-b52a1fb47f6e.png

Kinder Pointe Marketing,Kinder Pointe Marketing helps B2B companies bring sales-critical programs and products to market on time.,https://static.semrush.com/agency-directory/uploads/images/b1/b1fbb79b-faa5-4788-913e-33057fbcac7a.png

DynamoCX,We provide Performance Driven Experiences by connecting with Your Customers & Driving Results that Impact the Bottom Line. DynamoCX provides you the POWER of enterprise grade digital experience at an affordable cost for medium sized businesses: ,https://static.semrush.com/agency-directory/uploads/images/46/4686c8ed-a0d9-4ade-b70e-b453c5f78b49.png

Marketing for MSPs,"Our inbound lead generation strategy boosts visibility and increases opportunities with a strategically optimized website, proven SEO strategies, email, blogs, and much more. In addition, we created our own technology directory website to drive live ",https://static.semrush.com/agency-directory/uploads/images/6f/6f7caf6d-a2db-41f4-bf82-685872cc9ba3.png

Reach Ecomm - Strategy and Marketing,"Our services scale from targeted digital marketing for small businesses, to full-scale eCommerce automation, marketing campaign KPI reporting, insights, strategic planning and consulting, enterprise-grade process engineering, and implementation.",https://static.semrush.com/agency-directory/uploads/images/50/50dbaace-c26f-47b6-b181-373d63c604ac.png

lass machen - Agentur für Digitalisierung GmbH,"We are a young agency from Hamburg, specialized in search engine optimization, web design and digitalization processes. As a full-service agency, our team of experts works closely together on every project. We approach every step with commitment, ",https://static.semrush.com/agency-directory/uploads/images/01/0130a7db-1c4d-4ebe-8aee-4de2172a60b5.png

Zelst,Zelst is a highly experienced search marketing agency that helps clients to be seen and get found online. We help you to achieve a substantial return on your marketing investment through creative and strategic search marketing. ,https://static.semrush.com/agency-directory/uploads/images/b1/b18e1542-401d-44bd-94c1-1a13a5fc3c53.png

Loop Digital,"Founded 7 years ago as a one-man band, today we’re a strong team of 16 (+1 pooch) and continuing to grow. Every member of the team brings a variety of unique marketing-centric skills and experience to the table spanning our creative, SEO, ",https://static.semrush.com/agency-directory/uploads/images/92/92368298-38e4-4b97-8c0b-23bab6d5c778.png

Digital Results - Digital Marketing Agency,"Your digital marketing agency should be focused on delivering the best digital results for your business. That's precisely what we do! We specialize in SEO, SEM, PPC, digital advertising, social marketing, and search engine optimization consulting.",https://static.semrush.com/agency-directory/uploads/images/68/686b2f93-a4c2-40e8-84c5-54ea7cc27806.png

Click Here Digital,"Click Here is a full-service digital marketing company with three decades of award-winning expertise. We are strategic consultants that provide the most advanced digital marketing solutions for our clients with experience in local SEO, e-commerce, ",https://static.semrush.com/agency-directory/uploads/images/64/644141af-9b30-4cd7-913f-6091d2b80a33.png

Clear Click,"Clear Click focuses on providing multi-channel marketing insights and strategic consultancy so our clients can achieve maximum growth. As an independent agency, we work with clients from a wide range of sectors and treat them as our partners, ",https://static.semrush.com/agency-directory/uploads/images/98/98307f94-04d5-418e-8ba8-65f8de210895.png

Octiv Digital,"Octiv Digital is a digital marketing agency providing local and enterprise SEO strategy, paid advertising management (Google Ads), web design / development and analytics consulting services. We specialize in growing traffic for small-to-medium sized ",https://static.semrush.com/agency-directory/uploads/images/84/84a8714b-c534-43d1-a2c6-d5b2160583f7.png

Cube Creative Design,"Our goal is to help your businesses grow by managing your online presence. This includes your website, website content, social media, online reputation, and online advertising. Inbound Marketing Specialists - We're Recommended. Cube Creative was ",https://static.semrush.com/agency-directory/uploads/images/32/328e67a5-3f28-4c30-97e3-a618de25ccfc.png

Attractor Solutions,"Attractor is a team of creative technologists who define, design and deliver multi-channel technology and media solutions through audience data insight and beautifully crafted customer experiences. We bring brand stories to life and identify the ",https://static.semrush.com/agency-directory/uploads/images/a9/a9551bb1-87af-4f90-abc0-80ebe4df36e6.png

Rosa eSolutions,"Rosa eSolutions is a well-reputed digital marketing company that has a strong love for helping customers accomplish considerable beneficial success. Designed to be digital champions, we help brands – whether big or small – increase their search ",https://static.semrush.com/agency-directory/uploads/images/06/0609e17b-c1ba-483a-8aa0-8e5e9b334547.png

Bold Craft Marketing,"Established in 2017, Bold Craft Marketing is an award-winning digital marketing agency. Adept at evaluating digital markets and delivering winning strategies and communications in Global Markets, including Europe, USA, and Australia. Bold Craft ",https://static.semrush.com/agency-directory/uploads/images/32/321f9d08-ed83-4aa0-90e4-4bc3f11ae404.png

karsch.consult | digital marketing & online sales,"karsch.consult - endlich gehts voran 🚀 SEO, Social Media und Social Ads einer großen Agentur zum Preis eines Freelancers. Datengestützt und Transparent! #WissenWasWirkt #KundenErfolgSüchtig + SEO + SEO Schulung für Ihre Angestellten + Data Driven ",https://static.semrush.com/agency-directory/uploads/images/5d/5d851d11-2a5e-4872-8ba0-bb03c448de98.png

Magic Logix,"Magic Logix is a transformative marketing technology agency that fully utilizes every medium necessary to transform human behavior into consumer action. It is our unique combination of innovative design, sophisticated coding skills, and intuitive ",https://static.semrush.com/agency-directory/uploads/images/8b/8ba873e9-deee-473d-bfe5-e7c09fe051ea.png

SEO by Sociallyin,Do you want to rank higher on Google? Are you tired of relying on ads for traffic? SEO by Sociallyin is a 100% search-focused agency that guarantees performance and exclusivity in select industries. Our team is associated with Sociallyin - the top ,https://static.semrush.com/agency-directory/uploads/images/3d/3dae8b33-0a56-4f59-8212-c3b3a322f3da.jpg

Tabuga SRL,"We accelerate how organizations work, generating growth through technology, intelligence, and automation. We aim to facilitate knowledge and correct application of technology and innovation for generating results.",https://static.semrush.com/agency-directory/uploads/images/3f/3f668f9b-2920-4790-8441-27baf7a33af8.png

CS Solutions Inc.,"CS Web Solutions is a Mississauga-based proficient Web Design and Development Company. For more than ten years, we have provided businesses in Mississauga and surrounding areas with responsive web design and development, eCommerce, custom WordPress ",https://static.semrush.com/agency-directory/uploads/images/ab/ab04316d-fac5-4cec-a7c3-16a386c11c1f.png

Damteq,"Damteq is a Specialist Digital Marketing Agency in Hampshire. Our deep understanding of human behaviour underpins our technical approach to SEO, PPC, UX/UI and Website Design to create more intelligent digital campaigns and experiences. ",https://static.semrush.com/agency-directory/uploads/images/3b/3b174c75-aaa4-463b-aa7d-ba5fe814b883.png

Sullymedia,"I've been studying and practicing marketing for over 20 years, from billboards to PWAs. I apply this well-rounded and creative experience to helping non-profits and businesses show off their best qualities.",https://static.semrush.com/agency-directory/uploads/images/ac/aced95f7-c975-429d-8cba-85e79b72b025.jpeg

Meedya,"Meedya è la prima Omnichannel Agency in Italia, al fianco delle PMI Italiane ogni giorno. Costruiamo per loro un'audience multicanale con contenuti liquidi. Adattiamo idee e creatività alla necessità di mercati e comunità d'interesse in continua ",https://static.semrush.com/agency-directory/uploads/images/29/293e11a9-b505-459b-9450-885bd64c8464.png

Mr Seo,"Mr Seo Is specialist SEO agency in the UK that provide transparent and ROI led results. We work with local businesses as well as national ecommerce focused clients across a range of industries including travel, hospitality & B2B for example. Get ",https://static.semrush.com/agency-directory/uploads/images/b0/b00c2328-cb33-4f6a-96c8-dc9fe7198f66.png

SEO Troop,"SEO Troop continues to grow businesses exponentially with proven digital marketing strategies. Our SEO and PPC marketing experts are backed by a full team of senior developers, allowing us the flexibility and functionality to optimize our digital ",https://static.semrush.com/agency-directory/uploads/images/4a/4ae77dbe-eec6-4194-8117-3b497a0a2613.png

Atlas Agency,"With years of experience, we will modernize and optimize your website to complement your SEO strategy. We can help your business get the traffic it deserves with detailed SEO strategies and implementation. Our web developers and designers have ",https://static.semrush.com/agency-directory/uploads/images/69/69797c9c-c919-4580-b316-1178c2da2ceb.png

Digital Kings Marketing,"A premier internet marketing agency, backed by a data-driven approach and cutting-edge creativity, Digital King’s greatest ability is to get you the results your business needs. Explore our services and make your mark in the digital world with the ",https://static.semrush.com/agency-directory/uploads/images/e5/e51931f3-48e0-4c05-9ef5-b02a4005c9e5.png

Digiligo,"Digiligo is an agile, smart, and innovative company working in the digital marketing, customer experience, and digital branding space. With its expertise and capabilities, the company in collective has driven over $81 million in digital revenues for",https://static.semrush.com/agency-directory/uploads/images/ee/eee5813f-c5bd-45ef-8983-33ed28cb78e0.png

Strat Engine,"Strat Engine est une agence de marketing et digitale. Elle accompagne les TPE, PME et ETI dans leurs démarches stratégiques. Son objectif est de vous offrir tous les outils stratégiques et technologiques pour vous aider à atteindre les sommets. Sa ",https://static.semrush.com/agency-directory/uploads/images/72/72265aeb-b4a9-4b0f-9eb6-7e3876102758.png

Ignite Ave,Get the most out of your digital marketing! SEO that actually works! Social media marketing that delivers results! Content creation for business success! Web design that converts!,https://static.semrush.com/agency-directory/uploads/images/03/03508c77-1a98-4b00-86f3-863133aa639f.png

Becurious,"Becurious develops hotel brands, expands guest reach and generates more revenue for hotels. We do this through carefully crafted digital hotel marketing strategies that delight and engage future guests. ",https://static.semrush.com/agency-directory/uploads/images/aa/aabbf32c-f7dd-4fb7-ae9a-3830d7fc3405.png

Boostr.se,Boostr is an experienced company that mainly works with SEO. The people behind the company have been in the industry since the mid-2000s. Where focus on growth for our customers is our priority. We work exclusively with keywords that have a proven ,https://static.semrush.com/agency-directory/uploads/images/dd/dd17603e-da19-4e00-94a6-23f0761827b5.jpg

Rise Visible,"Full service digital marketing agency in Eugene, Oregon. We specialize in Internet Marketing, Website Development, SEO & branding. We are strategic growth partners that help you leverage the best platforms and services to solve your biggest ",https://static.semrush.com/agency-directory/uploads/images/7c/7cf2e7b9-1f44-4384-ba7e-3f563ff0d6d1.jpg

Peaks Digital Marketing,"Full service Enterprise, B2B, B2C SEO firm specializing in competitive markets. Expand your online presence with the next generation of SEO and lead generation campaigns in a scalable, repeatable, data-driven manner. Our mission is simple; provide ",https://static.semrush.com/agency-directory/uploads/images/af/afe1c2f0-7519-4624-b495-17ffddf4d757.jpg

David Dennison SEO,"My work as a digital marketer is based on the belief that amazing marketing is the key to the success of any business, especially when it comes to YOUR business. Great marketers are hard to find - and great marketers who are able to share the vision ",https://static.semrush.com/agency-directory/uploads/images/08/08b4daea-0621-433f-a36b-ec4ccb5e1251.jpg

Cosmik Carrot,"We help passionate business owners who want to thrive and succeed in boosting their business through the web stratosphere. Our WordPress websites can showcase your expertise, attract ideal clients, and deliver sales, even if you know nothing about ",https://static.semrush.com/agency-directory/uploads/images/3b/3b3dbde7-ceca-495e-9935-96920b694e82.jpg

Chain Reaction,"We are a team of industry-leading specialists in digital marketing, data analysis and communications. We’ve been partnering with local, regional and global brands across multiple sectors since 2010 from our offices across the Middle East. We combine ",https://static.semrush.com/agency-directory/uploads/images/d2/d2ee4dca-585c-49e5-ba0f-c7ae5ec72d5d.jpg

The Tadpole Agency,"The Tadpole Agency is a digital marketing agency that helps brands establish a presence they can be proud of. We provide a wide range of valuable marketing services and solutions, including digital advertising, branding, videography, web design and ",https://static.semrush.com/agency-directory/uploads/images/34/34ce3840-3682-474c-9957-856d456e9784.png

Meedya,"Meedya è la prima Omnichannel Agency in Italia, al fianco delle PMI Italiane ogni giorno. Costruiamo per loro un'audience multicanale con contenuti liquidi. Adattiamo idee e creatività alla necessità di mercati e comunità d'interesse in continua ",https://static.semrush.com/agency-directory/uploads/images/29/293e11a9-b505-459b-9450-885bd64c8464.png

Suffolk County Webmasters,"Suffolk County Webmasters (Sucoweb) is a website creation company based on Long Island, New York. We specialize in designing, managing and optimizing business websites, especially for small businesses who need to appeal to a local audience. ",https://static.semrush.com/agency-directory/uploads/images/82/8223e592-e126-4f21-b1b5-c1438b4b1e1e.jpg

Tribord Digital,"Une agence digitale et créative, 100% indépendante. Qui aide les marques à tracer le bon cap. Conseil, UX/UI, Développement web, E-commerce et webmarketing. Nos experts vous accompagnent dans la mise en place et la réussite de votre stratégie",https://static.semrush.com/agency-directory/uploads/images/84/8498e8e4-d669-445a-aa70-a9e1d4f81280.jpg

Exo Agency,"Exo Agency is a digital marketing agency that specializes in web design, mobile development, SEO, and pay-per-click management. Our goal is to allow businesses from all over to reach the potential they crave. We’ll do so by helping with modern ",https://static.semrush.com/agency-directory/uploads/images/04/04646eec-79df-4116-aa4f-c04103ea44a5.png

social:definition,"Our team consists of marketers, brand and design specialists, copywriters, photographers, online specialists, trainers. We recognise that for your business to achieve its goals you will need to become more strategic and commercially focused –",https://static.semrush.com/agency-directory/uploads/images/75/75960cba-f09d-4ee1-b82f-9f4efbde6afb.jpg

Allegiant Digital Marketing,"Over 20 Years of Digital Marketing expertise in SEO, SEM, Social Media, and Web Design and Development. We specialize in Home Services, Franchise, B2B, Medical, Legal, Insurance, and more. We excel in niche markets and are equipped to support SMB ",https://static.semrush.com/agency-directory/uploads/images/9b/9befdfb3-b905-4222-b33d-1021940d1104.png

Belt Creative,"Belt Creative is a website design, development, and SEO agency that specializes in Webflow and Squarespace website development. We work closely with our clients to develop a brand, website, and SEO strategy that drives long-term success. ",https://static.semrush.com/agency-directory/uploads/images/5e/5e0d3df4-b54e-4783-bb29-ef60081d9d4d.jpg

BizzyWeb,"We are a Digital Marketing Agency and Hubspot Partner Agency located in Minneapolis Minnesota. We have over 20 years of experience specializing in Inbound Marketing, Web Design, Content Marketing, Social Media, SEO and PPC. ",https://static.semrush.com/agency-directory/uploads/images/ab/abf30899-ff2a-4b6d-9a56-0ab3908548c7.png

ScaledOn,ScaledOn is an international digital marketing agency specialized in scaling up your business via testing. We have a team of top 2% digital marketers who are ready to help you achieve your growth goals. ,https://static.semrush.com/agency-directory/uploads/images/40/40c83a56-c2f4-4a7c-bd49-89f3be70d56f.jpg

Aspiration Marketing,"At Aspiration Marketing, we are dedicated to helping exciting businesses achieve new levels of growth. We believe in Content Marketing supported by exceptional SEO as a cornerstone to turn your website into your best sales agent.",https://static.semrush.com/agency-directory/uploads/images/99/995e64a9-710e-46ba-aa94-ab29fec22e0c.jpeg

N U A N C E,"Professional strategy, design, web development, SEO, and content services. User experience, organic search capabilities are at the forefront of what we do. We also provide paid campaigns and strategic marketing solutions. We build quality ",https://static.semrush.com/agency-directory/uploads/images/57/576da7be-c5e6-4045-b20c-7f7707f9334d.png

Trafiki Ecommerce,"We are a specialist eCommerce marketing agency that blends data with innovation to create targeted SEO, UI/UX, and PPC strategies. Having operated within the eCommerce world for over a decade, we understand the performance problems that stifle the ",https://static.semrush.com/agency-directory/uploads/images/c7/c71222ef-ffd5-439e-bd75-5f3d4003f667.jpeg

