Company Name,About,Logo
Elivate,"We help businesses grow, launch products, and build enduring relationships with their communities ",https://static.semrush.com/agency-directory/uploads/images/3f/3f1c4ce5-0fb2-4c23-a074-16578bea5a05.png

Salt Rank,"From Internet marketing to the design and presentation of your website, your online presence has become the most critical part of your business. We recognize this and have set out to provide professional services that deliver the quality you need to ",https://static.semrush.com/agency-directory/uploads/images/77/771d48de-27d6-46e5-a0ac-413894302d23.jpeg

Infintech Designs,"Infintech Designs is one of the leading digital marketing, seo, & web design companies in New Orleans. For over 18 years in the digital marketing industry, we have worked with hundreds of clients build more profits through generating measurable ",https://static.semrush.com/agency-directory/uploads/images/8c/8c9b1e3b-4ad6-43bd-8072-1aedab02ebaa.png

Rocket Agency,"Rocket Agency is an award-winning agency of 30+ digital marketing specialists. Our sole focus is on fuelling the business growth of our clients through digital channels, specifically SEO, Google Ads, Social Media Ads and Email. We have been around ",https://static.semrush.com/agency-directory/uploads/images/56/56b45373-4b64-4248-ae9f-c35a89f80963.jpg

VisualFizz,"We're VisualFizz. We create digital marketing experiences that tell stories & win customers. We are a full service digital marketing agency that works with growth-stage organizations building their brand, mid-size companies looking to outsource ",https://static.semrush.com/agency-directory/uploads/images/97/97b8fc55-124a-4ada-b304-3649c452f7fc.jpeg

Intergrowth (formerly Junto),Intergrowth is an SEO-centric content marketing agency focused on scaling high-growth businesses. We help high-growth businesses to overtake the industry leader in customer acquisition through long-form content + link building. ,https://static.semrush.com/agency-directory/uploads/images/4f/4fee6a52-26df-434f-999b-0b906f82870b.png

Optimized Webmedia Marketing,"Optimized Webmedia Marketing is headquartered in Vancouver, BC. We are a 360 Degree Digital Marketing & Lead Generation Services Agency. We specialize in driving sales through Digital Marketing, including SEO (organic Search Engine Optimization), ",https://static.semrush.com/agency-directory/uploads/images/fe/fe2c16ce-2c98-4c78-bb1f-8d1aaa886810.png

Actuate Media,"Actuate Media facilitates data-driven B2C & B2B relationships through digital marketing channels. Our digital agency strategizes and implements brand and conversion-focused digital advertising campaigns, capturing the data to improve our ",https://static.semrush.com/agency-directory/uploads/images/80/8066fb4d-1f85-41ff-b367-094af88cce71.png

Karen Dauncey,Blue Cherry is a boutique digital marketing agency specialising in helping businesses get found online using SEO & Google Ads. Running since 2008 we have helped hundreds of businesses generate more traffic and revenue from the front page of the ,https://static.semrush.com/agency-directory/uploads/images/cc/cc71b3da-8735-4297-945a-659e17b913ea.jpeg

4B Marketing,"4B Marketing establishes high-touch consultative client relationships. Our focus is business outcomes, and we use go-to-market strategies, traditional and inbound marketing, and branding to attract, convert, and delight your customers (and ours). ",https://static.semrush.com/agency-directory/uploads/images/db/db1e53ea-65c7-4dbb-bb84-e969cec67b95.jpg

Beanstalk Web Solutions,"Since our official launch in 2013, we have always stuck to our mission statement: We strive to provide web-related services that go above and beyond the expectations of our customers at a fair and reasonable price. Web design and digital marketing ",https://static.semrush.com/agency-directory/uploads/images/51/51daeb91-8fe1-4676-b46b-b04e4a7e0a70.png

Pain-Free Dental Marketing,"We are a full service digital marketing agency, focused EXCLUSIVELY on the dental space. From pediatric, to orthodontics, to general dentists and even implant specialists, dental marketing is all we do. We understand the industry and how patients ",https://static.semrush.com/agency-directory/uploads/images/3f/3f0cc839-c67a-4555-9937-bad4fdbad3d3.png

Knowmad Digital Marketing,"We work with clients in industrial, scientific and healthcare industries to grow revenue by driving and converting traffic from organic search, paid advertising channels and well-designed web experiences. ",https://static.semrush.com/agency-directory/uploads/images/e0/e009c5f2-74c8-4bef-8531-179ac75259e1.png

White Label Club,"The World's Premier White Label Digital Marketing Agency. Built to help agencies grow and scale while providing the highest quality services, custom strategies and agile campaigns. ",https://static.semrush.com/agency-directory/uploads/images/2f/2f845558-d2b8-462e-8d8d-fa77e69a1536.jpeg

Eurisko,"Eurisko aspires to be Perth’s best SEO agency by helping get you noticed for the big-ticket keywords that make a difference to your business’s bottom line. We are a free-thinking and creative digital marketing team that specialises in innovative, ",https://static.semrush.com/agency-directory/uploads/images/59/592dd8d6-e13d-4889-8ff7-6e57c8aae2d0.png

Brothers Digital,"Brothers Digital is a full-service digital marketing agency in Newcastle. We support ambitious businesses by combining creativity and technical proficiency to create smart, user-centric digital experiences to engage, excite and motivate your ",https://static.semrush.com/agency-directory/uploads/images/48/48124bcc-f00c-48d5-8461-4e511c517778.png

Spark Interact,"As a Sydney based web design and digital marketing agency we focus on inspiring design, custom web development and innovative marketing, for small to mid sized businesses. We engage, educate and inspire our customers with a comprehensive suite of ",https://static.semrush.com/agency-directory/uploads/images/f6/f64cfb77-4308-4625-b6f8-4ae876c56954.png

Search Planet AS,"We are an SEO agency in Oslo, Norway specializing in Search Engine Optimization for large e-commerce companies, web shops and large organizations in the Nordics. We help our clients in Norway, Sweden, Denmark and Finland make billions in each ",https://static.semrush.com/agency-directory/uploads/images/53/5382a7bc-8043-4619-9ac6-4259a1ccabe8.png

EverEffect,"As a company, EverEffect has been helping to improve business for small, mid-size and large enterprises for over 13 years. Each member of our cutting edge marketing team brings a wealth of knowledge and know-how that truly lifts your digital ",https://static.semrush.com/agency-directory/uploads/images/1b/1b6c0082-1a23-4d0d-9271-fbe9bff3843e.jpg

"Global Reach Internet Productions, LLC.","About Global ReachA History of Web InnovationGlobal Reach was founded in 1995 and since then, it has become a leader in content management solutions, custom web development, and a trusted digital marketing agency. We are proud of our Iowa roots ",https://static.semrush.com/agency-directory/uploads/images/20/2028a14d-c303-414c-8526-aab64f6dcc66.png

International Internet Advertising Services Inc.,Experience success with strategies we use to help great businesses grow. ,https://static.semrush.com/agency-directory/uploads/images/86/86d25391-e2ec-484c-9a21-a45e8bc30cdc.jpeg

Shen Lam,"Eightball Media is a Web Design & Digital Marketing Agency located in Brisbane, Qld. We build world-class amazing websites along with providing Online Marketing and Advertising solutions across a broad range of industries. We support an ",https://static.semrush.com/agency-directory/uploads/images/8f/8fd9a344-ef2d-49ae-ab33-202547e4a959.jpeg

Pixel Portal,"Give your business the website it deserves.  We love giving our clients powerful, professional and stunningly-designed websites that connect with their customers to grow their business. It feels good to give, and when it comes to websites that work, ",https://static.semrush.com/agency-directory/uploads/images/e6/e6b9ede7-df55-4ccc-8bcc-d3479e029998.png

Axer Strategies,"At Axer Strategies, we create a custom marketing plan by analyzing your business data, unique audience data, and target markets. We manage a vetted network of service experts to execute and support your marketing plan. ",https://static.semrush.com/agency-directory/uploads/images/6c/6c121563-2136-44f4-96c6-9adf01e82b48.png

Social Spark Media,"We’re focused on determining our clients’ needs to create a website that works for them. We focus on your goals and stick to the principals that a website should be: built with solid tools, secure and protected, fast and mobile friendly, search ",https://static.semrush.com/agency-directory/uploads/images/94/94ecb008-b72b-44c2-aa61-61542baab839.jpeg

Romain Berg,Our business philosophy is to take your business to a next level using our experience in Digital Marketing. Creating a constant flow of trust by working directly with you to increase your conversions using the tactics that create results. We're an ,https://static.semrush.com/agency-directory/uploads/images/98/98fe3924-fbc8-4355-9245-add3baafd8d7.jpeg

First Pier,"First Pier, a division of Helm Digital, specializes in total commerce solutions, from eCommerce web development to branding. Located in Portland, First Pier is Maine's first Shopify Expert, and specializing in the implementation of Shopify, Shopify ",https://static.semrush.com/agency-directory/uploads/images/ff/ffb2f521-a8e7-4439-beb6-956e8b5a647b.png

Skjoldby & Co,"At Skjoldby & Co, we really just want to execute and create value - quickly.We believe that marketing is about creativity, but to be effective - both in the short and long term - marketing must be executed with business understanding, ",https://static.semrush.com/agency-directory/uploads/images/b1/b194eb56-c0f3-4888-b3e5-a350568d275b.png

Digital Attic,"Since 1991, Digital Attic has been pioneering innovative web, video, and multimedia solutions.We have the experience and creativity to help market your business effectively without busting your budget. Simply put: We strive to make the complex ",https://static.semrush.com/agency-directory/uploads/images/9b/9b398233-c153-4278-92cb-bab45855dddc.jpeg

Robyn Smart,WordPress Website Design for small to medium-sized businesses.   ,https://static.semrush.com/agency-directory/uploads/images/00/00af3eee-8d3f-4147-b84a-33e9ce9d8798.png

Zimple Digital,"As a Newcastle-based digital agency, we are invested in understanding local business needs in the digital space. We take a holistic approach to your digitally-driven targets, discover what you need through data and implement a bespoke strategy that ",https://static.semrush.com/agency-directory/uploads/images/b6/b6b8f155-ca29-4c83-9d2f-21ebf4f2cef6.jpeg

Geek Powered Studios,At Geek Powered Studios we are a team of passionate Geeks dedicated to growing our clients’ businesses and solving their digital marketing problems. Our core values help us navigate the ever changing online landscape and develop long-lasting and ,https://static.semrush.com/agency-directory/uploads/images/34/34a5de78-7504-46d9-8b48-81bb4ab047a6.png

"K6 Digital Marketing, Inc.","K6 helps businesses grow your business via flexible, scalable and affordable digital marketing services.  ",https://static.semrush.com/agency-directory/uploads/images/f3/f3b0b88f-2c12-48d6-9a5b-995b8fead2f9.png

iSynergy,"iSynergy is an integrated digital marketing agency with a laser focus on maximizing ROI for clients. We achieve high revenue-driving success across lead generation, e-commerce, and full funnel campaigns. iSynergy is an industry leader in ",https://static.semrush.com/agency-directory/uploads/images/e7/e732a3f7-a13f-40ed-b497-6361bece010d.jpeg

L7 Creative,"L7 Creative is the first digital agency to define and apply the principles of Digital Brand Engagement. Since 2001, L7 Creative has been growing powerful brands by integrating creative strategies with online technologies through its proven and ",https://static.semrush.com/agency-directory/uploads/images/a5/a572af84-f709-46db-8295-363a0cc6a9e7.jpeg

Perrill,"Perrill is a full-service digital marketing agency focused on driving measurable results. Located in Minneapolis, Minnesota, we work with companies of all sizes to help grow their businesses through comprehensive branding, creative, development, and ",https://static.semrush.com/agency-directory/uploads/images/f2/f27b83f2-b154-4be5-9430-46dc9e60655e.jpeg

Juggler Design,"We pack a punch when it comes to delivering design, digital strategy, branding, advertising and SEO services.It’s not surprising that when new clients start with a single job, we are soon managing most of the marketing needs for them. Our service ",https://static.semrush.com/agency-directory/uploads/images/8c/8cadeac0-3d28-48b3-913b-50988f6d58cd.png

internetwarriors GmbH,"Wir sind Ihr Ansprechpartner Rund um das Thema Online Marketing! Egal ob Suchmaschinenoptimierung, Search Engine Advertising, Webanalyse oder Social Media Marketing - wir stehen Ihnen mit unserer Expertise, sowie mit Rat und Tat zur Seite!",https://static.semrush.com/agency-directory/uploads/images/92/92544e97-522d-4b98-aa88-f87cb69b7e45.png

The Belford Group,"The Belford Group is a digital marketing agency that provides original marketing and design solutions including branding, web development, search engine optimization (SEO) consulting, social media strategy, graphic design, and digital marketing.",https://static.semrush.com/agency-directory/uploads/images/81/812596fc-8d1f-4785-87f2-446491d2698f.png

Growth Tap Agency,"We're a digital marketing agency based in Sydney, Australia delivering ROI positive digital marketing campaigns. We focus our efforts on search marketing (paid and organic) and paid social for clients who want to increase the volume and quality of ",https://static.semrush.com/agency-directory/uploads/images/2d/2dba8d90-4752-4d6a-b220-5ef32077d9cf.jpeg

Grand Cru Digital,"Grand Cru Digital specialises in all things Google! We help small businesses gain more exposure on the Google search result pages via SEO (search engine optimisation) for websites, Google Ads management, Google My Business and Google Shopping ",https://static.semrush.com/agency-directory/uploads/images/84/846c5487-febc-4164-905b-54a68eac477f.jpeg

Goebel Media,Search engine optimization involves making content and development improvements to your website that allow Google and other search engines to understand the key terms for which you should be ranking. Our research-driven process will improve your ,https://static.semrush.com/agency-directory/uploads/images/c4/c42e3f3e-2ea6-4f62-95cd-9ea329604298.png

Gauge Digital Media,"Gauge Digital Media, a digital marketing agency, offers professional web design, SEO, social media marketing, pay-per-click advertising, video, and graphic design.Gauge Digital Media takes a unique approach to our marketing efforts. We offer a ",https://static.semrush.com/agency-directory/uploads/images/16/167590c4-ad05-4981-a631-eb985eb6f6ef.png

Deep Footprint,"""Deep Footprint is a data-driven digital marketing company focused on Search Engine Optimization (SEO), Search Engine Marketing (SEM), and Social Media Marketing (SMM). We help our clients across many verticals create and implement custom digital ",https://static.semrush.com/agency-directory/uploads/images/83/83b4de6d-a614-4b7e-b1da-299851182719.jpeg

ABC Web Service,"ABC Web Service is a full service web design and internet marketing agency located in Fort Lauderdale, FL. We specialize in custom websites, SEO, PPC and social media marketing. We count with a storefront, but work with clients all over the country. ",https://static.semrush.com/agency-directory/uploads/images/1f/1f7b9285-7a30-49a4-b19c-2346a346f15d.jpeg

Lform Design,"As a best in class provider of web design and web development for companies in the B2B industrial technology sector, Lform understands the importance of precision and consistency. Whether you are involved in engineering, manufacturing, distribution ",https://static.semrush.com/agency-directory/uploads/images/e1/e1be9874-cf2c-4f4f-9945-e011e278df2c.jpeg

"Smashel, Inc",Smashel provides digital marketing and lead generation for local and national businesses.  ,https://static.semrush.com/agency-directory/uploads/images/2a/2aa1e5cc-f511-4eca-9b15-3268264d05a8.png

FIBER,"We asked our FIBER (marketing) team why digital marketing gets them out of bed every morning, and we got a mixed bag of answers. For example, one team member said to give back to charities, and another said to rival Buzzfeed quizzes… What we at ",https://static.semrush.com/agency-directory/uploads/images/db/db2ceb70-a477-4f39-879a-4565ac8080c0.png

"Virtual Surge, LLC","Virtual Surge is a boutique digital marketing agency. We have SEO experts who specialize in Healthcare SEO and Retirement Community SEO however, we are still taking on other types of businesses who need SEO services. In addition to SEO, we do ",https://static.semrush.com/agency-directory/uploads/images/ed/edb72c39-9ee3-4314-a549-744da3e1309b.png

Netconcepts,"Netconcepts is a full-service SEO and digital marketing agency founded by renowned SEO expert Stephan Spencer. Stephan is a bestselling author and sought-after keynote speaker. Clients have included Zappos, Chanel, Quiksilver, Volvo, and Sony. ",https://static.semrush.com/agency-directory/uploads/images/8a/8a7ef00e-8b0a-4e71-afee-c024a644162e.jpg

"MarketVisory Group, Inc","MarketVisory Group is a HIPAA compliant healthcare marketing agency. We specialize in helping established, independently owned healthcare practices grow. We focus on medical, dental, surgical, psychotherapy, and holistic health practices. Clients ",https://static.semrush.com/agency-directory/uploads/images/41/418d1538-5404-4557-8baf-c7ce39e7c757.jpeg

97 Switch,"97 Switch is an award-winning Chicago digital marketing agency that specializes in marketing, web design and strategy.We take great pride in our relationships with people. We operate with the understanding that it’s all about being good to others ",https://static.semrush.com/agency-directory/uploads/images/68/6879ed01-7416-4a5d-8d65-279ceb2accf4.png

OKMG,"Strategy, digital, creative and marketing are the vehicles that we use to provide centralised, customised, and scalable business solutions for our clients. ",https://static.semrush.com/agency-directory/uploads/images/1a/1a6eb621-976c-426b-ad09-0474317a3305.png

Stigan Media,Web Design & Marketing Agency located in Vancouver. We believe in offering transparent marketing services at competitive rates. ,https://static.semrush.com/agency-directory/uploads/images/c5/c5c27d4c-01cd-4052-a61c-fdae88becbbc.png

Mower,"As one of America’s largest privately held full-service advertising and marketing agencies, Mower brings something special to the brand-building table: intense independence. This kind of freedom gives our group of almost 200 collaborative thinkers ",https://static.semrush.com/agency-directory/uploads/images/95/95f93d6b-c80b-4b49-8e2c-2e4582d3820a.jpeg

LFDM Marketing Advisors,"LFDM is a team of digital marketing advisors based in Orange County California, with a worldwide team.Our specialties include digital strategy, SEO auditing, custom marketing blueprints and bespoke marketing execution.Nothing we do is ",https://static.semrush.com/agency-directory/uploads/images/ba/baffbd9c-65e1-462d-8135-b1ef3f006a6c.png

Metric Labs,"Metric Labs is a multidisciplinary team who use mathematics, statistics and technology to deliver value to our clients.Whether it’s a local startup or large multinational, our team has delivered growth for clients in a variety of industries using ",https://static.semrush.com/agency-directory/uploads/images/5b/5b35365f-35b8-470d-a3c1-2ef82404aa65.png

Fishnet Media,Fishnet Media is an award-winning digital agency specializing in creating brand experiences that elevate customer confidence. ,https://static.semrush.com/agency-directory/uploads/images/07/07893bdf-653a-412e-a169-67c6ac31bf5a.png

SunCity Advising,"SunCity Advising is a San Diego digital marketing agency with a commitment to helping clients improve their internet presence. Since 2011, we have provided internet marketing services that include search engine optimization (SEO), PPC, email ",https://static.semrush.com/agency-directory/uploads/images/66/6630f029-3e7e-4a4c-96ef-f6a02cec4833.png

Konstruct Digital,"Say no to the status quo and say yes to digital marketing tactics that simply work.We've helped 100s of organizations just like yours grow!SEO isn't a black box filled with secret sauces, ninjas, and magic. At Konstruct, we have proven ",https://static.semrush.com/agency-directory/uploads/images/ec/ec74e24f-ee3e-4cde-9c9e-ad7e4de41f1f.png

Hennessey Digital,"Hennessey Digital is a two-time Inc 5000 full-service digital marketing agency with roots in SEO and specializing in organic and paid search. We’re a group of techy, creative humans whose talents are only outshone by our hustle. Our work puts our ",https://static.semrush.com/agency-directory/uploads/images/6b/6b755a97-4ccb-4e8c-be6e-e878b396f73b.png

Nerd Marketing,Notre mission chez Nerd Marketing est d’offrir à nos clients des stratégies de Marketing digital et de développement de leur visibilité sur internet. Nous proposons des solutions adaptées aux besoins de nos clients. Nous recherchons des clients qui ,https://static.semrush.com/agency-directory/uploads/images/c7/c758e831-0075-4dab-b090-c1dad485f3ba.jpg

Latitude Park,"Managed SEO is our all inclusive service that gets you targeted traffic from search engines locally and nationally.Our Experience Over the last decade we’ve formulated a proven strategy that works. We are leaders in the SEO industry, serving the ",https://static.semrush.com/agency-directory/uploads/images/8e/8ed51678-ced3-4f50-b916-627b9adaeb28.png

Direct Development,"DD is a family of brands centered around one mission — to help the Davids of this world beat their Goliaths. This is our approach, and it infuses every product, service, and resource we create. At the highest level, DD empowers people in the",https://static.semrush.com/agency-directory/uploads/images/6f/6fbe5cba-9ee0-4362-abdf-18c3e69eb58c.jpeg

theBREWROOM,theBREWROOM is a marketing company that is all about collaboration. We don’t just do Search Engine Optimization and Paid Search. We don’t just do web design and development. We don’t just do social media marketing. We work with you to figure out ,https://static.semrush.com/agency-directory/uploads/images/5b/5baaab67-b180-43c0-a77b-af17efa20b03.jpeg

Roger West Creative and Code,"Roger West Creative and Code is a full-service digital marketing agency delivering smart solutions for client growth, powered by compelling design and supported by strategic functionality. Founded in 2007 and based in Tampa, Florida, RWCC is a ",https://static.semrush.com/agency-directory/uploads/images/82/82a81b11-f571-4e6e-acb7-cfe622784fd3.png

TurnKey Marketing,"TurnKey Marketing is the industry leader for premium marketing & advertising services. We combine leading edge technology and our award winning hands on account management, to deliver measurable ROI that helps you sell more and positively impact ",https://static.semrush.com/agency-directory/uploads/images/b4/b4cbbc62-5829-42f4-861c-a5e961182b26.png

Intuitive Websites ,"Intuitive Websites offers a variety of internet marketing services. From strategic digital marketing and ecommerce, to websites, print and graphic design, we are a full service company that can handle all your online marketing needs.We are ",https://static.semrush.com/agency-directory/uploads/images/01/0153a396-7e48-4d4e-b5a3-183e08f0e35e.jpeg

Cloud Street Services,We have a hybrid onshore/offshore approach of expert quality for exceptional value. Our USA based Project Managers work closely with our seasoned India based SEO specialists. ,https://static.semrush.com/agency-directory/uploads/images/c3/c358245c-8488-43c2-a1ca-d016229f1184.png

Re:signal,"Re:signal is specialist eCommerce SEO and content marketing agency, driving organic growth for ambitious brands. We have worked with brands such as ASICS, WorldRemit, Expedia, Auto Trader, Totaljobs, JD Sports and more. We act as an extension to our ",https://static.semrush.com/agency-directory/uploads/images/96/96208137-86cb-45b0-90eb-871a5414a14e.png

Redback Solutions,"Founded in 1999, Redback is one of Newcastle’s longest-running digital agencies, specialising in website design and development, content creation and digital marketing services. From small-medium companies, to large institutions, government/councils ",https://static.semrush.com/agency-directory/uploads/images/c5/c5a097d8-abf5-404f-b4df-87d5675de73f.png

TalenAlexander,"TalenAlexander is a revolutionary idea hatched by Jason W. Ramsey. It has since grown into an advertising & marketing agency with old school philosophies, using new-school technologies, currently based in Charlotte, NC.“We’re an absolutely love ",https://static.semrush.com/agency-directory/uploads/images/93/931ef72d-75e6-4e07-a5fb-d9e271637d0d.jpeg

RedRhino,We build brands that customers fall in love with.Everything we do is about connecting you with your customers. We start with emotional branding to connect with their hearts and then we make it easier for you to connect with them no matter where ,https://static.semrush.com/agency-directory/uploads/images/32/3284d2ca-ad63-47dc-90af-5b1cbc92819e.png

