Company Name,About,Logo
Estes Media,"New Jersey Based digital marketing agency helping companies scale. From SEO, Content Creation, Ads, Web Design, and social media management. Everything we do as an agency boils down to helping your company better use your content/ ads/website/ ",https://static.semrush.com/agency-directory/uploads/images/fe/fe8a74ac-7778-4013-830a-d0b0d2608cfc.png

Website Genii,Website Genii is a results-driven digital agency dedicated to growth. We work with small & medium-sized companies to help them reach their full potential. We are excited to grow our business alongside yours because we understand the importance ,https://static.semrush.com/agency-directory/uploads/images/97/97aa7f29-9c54-4f9b-a8d3-f2ccc44e46e6.jpg

Peak Flow Online Business Management,"Peak Flow Online Business Management specializes in helping tourism businesses improve their online presence, and reducing the need for manual data entry. We do this through streamlining and automating their backend, improving their SEO, managing ",https://static.semrush.com/agency-directory/uploads/images/a3/a3f16a6b-ce7c-4483-a20f-c5997cb3829d.jpg

ST8,"ST8 (state) is a boutique digital marketing, media, and design agency located in Santa Monica, CA. We professionally manage and grow your business online. ",https://static.semrush.com/agency-directory/uploads/images/a8/a862a05e-eac2-4880-abf0-2d44346bec8f.jpg

SteerPoint,"SteerPoint is a full-service Digital Agency providing an array of professional marketing services including search engine optimization (SEO), social media, PPC, Web design & development, reputation management services, email marketing, video ",https://static.semrush.com/agency-directory/uploads/images/0b/0b682e88-911e-45cb-af12-9e34e6320b28.png

1 Stop Marketing Solutions - Digital Marketing,1 Stop Marketing Solutions is a full-service digital marketing agency offering a wide range of services tailored to our clients' unique goals. We grasp swift changes in the digital market and adapt our strategies to bring value to our clients.,https://static.semrush.com/agency-directory/uploads/images/30/3041e3aa-d321-43ed-8ea3-e56471601e0f.jpg

Growth Copywriting,Growth Copywriting offers affordable content marketing services and local SEO services to small to medium sized business looking to affordably increase all of their most important metrics and take advantage of content marketing; one of the most,https://static.semrush.com/agency-directory/uploads/images/06/06a65942-4280-4df6-8255-27d78eb054c7.png

AX Digital,AX Digital is a full-service creative digital agency enabling your brand to engage with your audience. AX Digital is here to help you through the process of building a strong digital presence that resonates with your audience.,https://static.semrush.com/agency-directory/uploads/images/e9/e9d72408-14bc-4e9a-a30f-da4f64d5510c.jpg

The Belford Group,"The Belford Group is a digital marketing agency that provides original marketing and design solutions including branding, web development, search engine optimization (SEO) consulting, social media strategy, graphic design, and digital marketing.",https://static.semrush.com/agency-directory/uploads/images/81/812596fc-8d1f-4785-87f2-446491d2698f.png

Longtail Dragon,"We live to help small businesses succeed in the modern marketplace! From content creation to search engine, we help you get discovered, grow your profits, and slay your competition!",https://static.semrush.com/agency-directory/uploads/images/3d/3dc6534f-2331-4880-8ae0-3431effc2268.png

YUURANK • SEO B2B Lille • Douai,♨️ Agence SEO pour les TPE/PME en B2B • Basée dans le Nord (Lille-Douai-Arras)• Stratégie SEO B2B • Référencement Local • Rédaction Web SEO • Suivi positionnement Google • Formation de vos collaborateurs en charge des contenus web ,https://static.semrush.com/agency-directory/uploads/images/43/43a6aaf7-d706-494b-9263-9a01ab343c2f.png

Wake Up,"At Wake Up, we make social media content that matters. We believe that if you want to build a successful social brand, you need great content - and that's where we come in. With our three-step process, we'll help you strategize, create, and post ",https://static.semrush.com/agency-directory/uploads/images/72/72be6448-152d-4e70-966c-7a7b4c609754.png

Alpha Efficiency,"Chicago Web Design, Development & SEO Agency, delivering unique aesthetics and traffic. Technical SEO, backlink building, content creation. We love all things machine learning and data-driven. Contact us for your quote on your next ",https://static.semrush.com/agency-directory/uploads/images/48/481daeac-66f8-4ce5-8203-bcbe7d191323.png

AltaVista Strategic Partners,"As the Nation's leading contractor marketing company, AltaVista specializes in digital strategies to help contractors grow their companies. We specialize in SEO, Database Marketing, Social Media Marketing, PPC Advertising, Website Development & more.",https://static.semrush.com/agency-directory/uploads/images/58/58859034-6f05-450e-af47-7351aa8ccff5.png

Local and Qualified,"Local & Qualified is a Lexington, SC based Digital Marketing Company that services clients nationwide. Our experienced team of digital marketers provide website design, logo design, SEO , social media marketing, and various forms of ",https://static.semrush.com/agency-directory/uploads/images/ea/eaee87d4-b995-4dce-a96b-091177f5e68c.jpg

South Made Marketing,"Let's Get People Talking! As digital marketing evolves so does our company. Collectively we have a background in business management, web design, graphic design, photography, creative writing, social media, sales and marketing. ",https://static.semrush.com/agency-directory/uploads/images/b5/b50f858d-d9f0-4824-877b-bab4ebb9dedc.png

Earned Media,"As a dedicated SEO agency, we can deliver scalable SEO strategies for a fraction of the cost of what a more traditional digital agency would charge. That’s because you work directly with the company founder Nick Brogden and other carefully selected ",https://static.semrush.com/agency-directory/uploads/images/43/4382e3d0-79ba-4beb-8ec1-9a78dc02acc8.jpg

Good Rep Media,"Good Rep Media is a digital marketing agency that specializes in helping small & medium-sized business owners achieve more awareness, and revenue online. We do this through a variety of services like web development, SEO, social media marketing, ",https://static.semrush.com/agency-directory/uploads/images/c0/c021813c-d0bd-4afb-b7a4-705e6b6b115a.png

JD Web Studio,"We're a Mississippi-based premier web design, SEO, and marketing agency. From WordPress web design to content strategy and social media management – we build websites and provide marketing that works. ",https://static.semrush.com/agency-directory/uploads/images/3c/3c62171a-3418-4e97-930b-cac61360e71f.png

Whizcrow Technologies Pvt. Ltd,"We are a full-service marketing and technology agency recognized by Startup India, MSME, ISO 9001:2015 certified, and a recognized Semrush Agency Partner. We help your business become profitable with just the right mix of marketing and technology. ",https://static.semrush.com/agency-directory/uploads/images/d5/d53ba9df-09a3-4018-b8a5-3d6afdc20245.png

Centipede Digital,"We open new doors for companies with bold, creative solutions that incorporate intelligence, creativity and consumer behavior to transform your brand into a platform for growth. We’re more than just an agency – we’re a committed partner to your ",https://static.semrush.com/agency-directory/uploads/images/41/41ff429b-3d74-46fc-9c05-6c3d77cd597c.png

Growth Skills,Growth Skills helps brands increase revenue and brand awareness using best-in-class Growth Marketing. Our Learning IQ platform offers sales and growth marketing training to help individuals thrive in the future of work. ,https://static.semrush.com/agency-directory/uploads/images/50/500f3cb6-66f0-4824-9911-0f19887bc27a.png

Rise Marketing Group,A performance driven marketing firm whose core task is to drive business growth for our clients through online marketing. Our data-driven process is designed to drive incremental growth. With our experience stemming back to the mid 2000’s and ,https://static.semrush.com/agency-directory/uploads/images/29/2901fb78-c8bf-4456-8da5-2e67f77605c8.jpg

8Bend Marketing,🤩 You found us! The ultimate SEMRUSH + StoryBrand Certified Agency to make marketing work like ⚡⚡⚡ for your business. SEMRUSH and StoryBrand certify the world's best marketers 🏆. But there are SO. MANY. CHOICES 😳. We want to make this decision EASY ,https://static.semrush.com/agency-directory/uploads/images/ca/cad202fb-66c8-433c-a80d-ee12a334de03.png

CNIP digital agency,"At CNIP, we believe that a brand is more than just a logo or a tagline. CNIP Digital Agency is your one-stop solution for all your digital marketing needs. We create brands from scratch and catalyze them for rocket growth!",https://static.semrush.com/agency-directory/uploads/images/57/5773f4b7-8039-4f1b-8eb8-1c987b801cfb.png

M16 Marketing,"M16 Marketing is an award-winning Atlanta based web design and digital marketing company providing digital strategy, branding, web design (UI and UX), web application development, SEO, PPC and social media management services. On average, companies ",https://static.semrush.com/agency-directory/uploads/images/ce/ce5e4bd3-7d8f-4297-b27e-a8acdadbc1ec.png

Direction.com,"Local SEO software for local businesses, the healthcare industry, and the travel industry starting at only $60/month, and SEO services starting at $5,000/month. We are a growing company based out of Austin, TX with a mission to create a company that ",https://static.semrush.com/agency-directory/uploads/images/83/83d8f035-c090-49d9-8538-bd55752a41ea.png

Bearpaw Partners,We are an independent digital marketing agency established in 2010. We collaborate with brands to generate connections and drive sales. All in. All the time. ,https://static.semrush.com/agency-directory/uploads/images/9e/9ef554f5-6b10-4686-b982-0ffae9dcc9de.png

Absolute Web,"Absolute Web is a Miami-based digital commerce agency that delivers exceptional results through custom eCommerce solutions, latest technologies and comprehensive digital marketing services. #Ecommerce #digitalmarketing",https://static.semrush.com/agency-directory/uploads/images/69/6985a9ac-1a09-4ed1-a451-1945a27eb2f0.png

itroom,Itroom har siden 2015 hjulpet en bred viftet af virksomheder med deres online udtryk. Både i forhold til webdesign og SEO. Vi skræddersyer altid et projekt så til passer jeres rammer. Vores SEO løsninger starter fra 1.995 - 4.995 kr.,https://static.semrush.com/agency-directory/uploads/images/c3/c376d606-7707-4410-8e44-99435f92d1c4.png

Tru Performance Inc,Tru Performance is an industry-agnostic digital service agency with technology at the core of our operations. Every interaction with an existing or potential client is an opportunity to make a meaningful difference in achieving their business goals. ,https://static.semrush.com/agency-directory/uploads/images/80/80238b8c-7204-4a4f-88fc-910ee2b96160.png

AWD Digital,"We’re a Melbourne-based digital agency transforming thoughts into creative digital products. At AWD Digital, we see the details in the big picture. That’s why we have perfected our digital marketing services all the way from start to finish; from ",https://static.semrush.com/agency-directory/uploads/images/69/69a0d1f3-a556-425f-adb5-95544954b8aa.png

Splurge,Splurge Media is a full-service digital marketing agency committed to helping small and mid-sized businesses succeed in our technology-driven digital world. Truly understanding your business is how we can deliver intentional and strategic marketing ,https://static.semrush.com/agency-directory/uploads/images/36/36e4b6d8-1d17-4531-931f-4c78a577fd95.png

EvenDigit,"EvenDigit is One of The Top Growth Marketing Agencies in India with 11+ years of experience in PPC, SEO, Google Adwords, Remarketing, Facebook Ads, Instagram Ads, LinkedIn Ads, Google Analytics, Bing Ads, and Lead Generation Campaigns For almost a ",https://static.semrush.com/agency-directory/uploads/images/48/48c3bfe4-4ff8-4268-b2cd-ec526a1fc06c.jpg

Digital Relativity,"At Digital Relativity, we help businesses understand how digital and traditional marketing can help them reach their goals. Our diverse team works together to produce high quality work that gets results. We love what we do, and it shows. ",https://static.semrush.com/agency-directory/uploads/images/00/007cef15-3a93-4fdd-80f6-7e50f7dfc04a.png

Fly High Media Ltd,"We are a digital marketing agency that helps businesses generate more traffic, leads and sales through SEO, PPC and Paid Social. We understand that every business is different, which is why we take the time to learn about your company and create a ",https://static.semrush.com/agency-directory/uploads/images/9e/9e6683e2-14fb-42c8-9a52-c5ce888d4859.png

2 Fish Company,"We are 2 Fish Company, LLC, an award-winning creative marketing agency. We work closely with our client partners, building relationships that allow us to solve problems and produce outstanding results. From design to development, marketing planning ",https://static.semrush.com/agency-directory/uploads/images/6f/6f9d947e-e5a3-4ca0-9916-29e265a7d0dd.png

LMD - LiveMediaDigital,"Live Media Digital is a top digital marketing agency in Miami. LMD focuses on real numbers, not digital terminology. Our services include Web Development, SEO, Google Ads, Facebook Ads, Instagram Ads, Linked In Ads, Bing Ads, Duck Duck Go Ads, etc. ",https://static.semrush.com/agency-directory/uploads/images/16/16b4187b-5ea1-4539-9eb8-73a224d34f5a.png

Tiger Media A/S,"Siden 2005 har Tiger Media A/S leveret effektive og driftsikre hjemmesider, webshops samt online markedsføring. Vi har samlet et kompetent team, som bestrider vidt forskellige faglige kompetencer med ét fælles træk; at levere professionelle online ",https://static.semrush.com/agency-directory/uploads/images/51/512038eb-b4f8-4f74-8f7f-77792a7b012d.png

Upper 1 Studios,"Upper One Studios started in 2007 as a video production company located in Anchorage Alaska, producing high quality productions for small and large businesses. Since then we have grown into a full service media production company producing tv ",https://static.semrush.com/agency-directory/uploads/images/20/20783c38-aca5-4f19-a4da-7a9f0993a3b9.png

MKG Marketing,MKG Marketing partners with hyper-growth cybersecurity and B2B tech demand generation teams to increase capacity and scale marketing efforts quickly as an extension of their team. We eliminate friction from the organic and paid buyer journey and ,https://static.semrush.com/agency-directory/uploads/images/71/71a5541a-7a6c-470b-a2e6-2deadcb6d13a.png

PuntoJS Estudio Creativo,"Posicionamiento en buscadores, Marketing, Transformación digital, Social Media, y Desarrollo Web ",https://static.semrush.com/agency-directory/uploads/images/d5/d587468c-ef17-45dc-a46c-9afe5c9e95c1.jpg

Adoraweb | Agence Web et Marketing Dig,"Adoraweb is a digital marketing agency in Luxembourg, expert in WordPress and Agile methodologies. We offer comprehensive services and long-term support, basing our strategies on factual analysis and continuous improvement.",https://static.semrush.com/agency-directory/uploads/images/be/be5273fe-4ca8-49b4-be3d-4ded4f0fd6e8.jpg

Swarm Digital Marketing,"Swarm Digital was proudly established in 2019 with offices in New York City, and Tampa, Florida. This effort was the culmination of the founders’ combined 25-years experience in the digital marketing industry. They’ve taken everything they’ve ",https://static.semrush.com/agency-directory/uploads/images/97/97c14ffa-88fd-4db9-a0e8-5d8a012cc889.png

1o8,"1o8 is a digital marketing agency focused on e-commerce and Amazon and services  companies in Food/Beverage, Toys, and Pets.  We are hungry to drive revenue growth and transactions for our e-comm partners and brands and merging brick and mortar ",https://static.semrush.com/agency-directory/uploads/images/f7/f7455b9b-e050-4482-ac01-6c7c56eea29e.png

Beeby Clark+Meyler,"Beeby Clark+Meyler ""BCM"" is a full service digital agency with services including Creative Services, Website Development, SEO, Paid Search, Social Media, DTC, Branding and Programmatic Media Planning and Execution ",https://static.semrush.com/agency-directory/uploads/images/dc/dc5c4cb6-c1ce-44a0-97f0-a6fc614d9d70.png

Priority Pixels,"Our in-house team of creative, marketing and digital experts offer professional web design, search engine optimisation, paid advertising, social media and all aspects of graphic design.",https://static.semrush.com/agency-directory/uploads/images/1c/1c91e3b5-e8fe-4ea5-b065-6b5ef06bf077.png

Cheetah Agency,"We're a full service agency focused on creative, marketing and technology. Our ability to take projects from a name to custom innovative tech-based solutions separates us from the others. At Cheetah, everything your business needs is under one roof.",https://static.semrush.com/agency-directory/uploads/images/88/88a7b1f3-d40c-4998-a5bd-e37baaf3a439.png

Havoc Digital,"We have provided our expertise throughout the years to thousands of businesses around the world. We provide efficient and highly effective SEO & SEM services demonstrating effective strategies, methodologies, and techniques that provide a ",https://static.semrush.com/agency-directory/uploads/images/0a/0aa4b685-279c-43db-856a-29bb2e8fb62a.png

Plus Your Business,"HubSpot Partner Agency, based in the UK - serving clients worldwide. We only work with companies using HubSpot - and provide marketing services (Content marketing, SEO, Ad management etc).",https://static.semrush.com/agency-directory/uploads/images/c8/c8caa5da-4878-4029-8e5f-a93f5d6bbe0d.png

LeadAdvisors,"We customize a plan based on customers' marketing objectives by incorporating content audit, website audit, and brand identity to ensure we can add value for each brand based on its niche, capacity, market size, and industry. Our marketing",https://static.semrush.com/agency-directory/uploads/images/5b/5b72bc81-6cdb-48ff-9133-3fad9b1819fd.png

Krative,"Krative is a boutique marketing firm that specializes in brand strategy. From branding & identity to design & marketing, we've helped many brands (big and small) to increase brand awareness, engagement, and revenue. ",https://static.semrush.com/agency-directory/uploads/images/00/00aeaadf-750c-49ab-ae18-6ca6d0d071e6.png

Padula Media,"Padula Media is a digital marketing agency specializing in social media advertising, google advertising, video production, photography, and website design. We offer services nationally to all types of businesses. We are specialists in the field of ",https://static.semrush.com/agency-directory/uploads/images/09/094bc199-8cc5-4183-af82-e19026a3e356.jpeg

Chalk n Cheese Digital,"We are a full digital marketing agency based in Auckland! We have been operating a complete online marketing service for 5 years now, and we offer tailored services including, but not limited to: - SEO (Search Engine Optimisation) Strategies - ",https://static.semrush.com/agency-directory/uploads/images/70/701b06ee-10d0-486b-961b-27f1687bd6de.jpg

Numo by digitalfarm,Numo is a full-service digital marketing agency. We’ve been providing a wide range of services to clients of all industries. Our digital marketing services include consulting and management options for a variety of online marketing tactics including ,https://static.semrush.com/agency-directory/uploads/images/cd/cd192546-59e8-4e0a-a6df-8792db202271.png

The ABM Agency,"The ABM Agency is a full service B2B digital marketing agency that specializes in account based marketing, B2B lead generation and demand generation. Our expertise includes tactics & orchestration, asset creation, digital media channel ",https://static.semrush.com/agency-directory/uploads/images/8c/8c19d135-241a-404f-8ad6-845f6c61b8dd.png

Two Tall Global,"We provide strategic SEO services- optimizing your website and content- as well as full-service, managed monthly services to drive noticeable and long-lasting search engine ranking results. Our digital marketing process concentrates on your small ",https://static.semrush.com/agency-directory/uploads/images/7c/7c38ac97-a9f0-422e-995e-336c1b3ea4ca.png

Jason's Creations Inc,"Jason's Creations Inc is full-service marketing agency that specializes in freight, logistics and supply chain management. Whether a 3PL or trucking company, our SEO expertise & copywriting are unmatched and built to support YOUR brand.",https://static.semrush.com/agency-directory/uploads/images/49/49d35ff0-3257-4aa3-8b06-b56d6ed21825.png

Natural Index S.B Srl,"With a track record of more than 800 projects optimised, Natural Index ranks among the top players within the EU in the field of SEO optimisation. Natural Index's approach to SEO is focused on natural practices and long-term benefits, ultimately ",https://static.semrush.com/agency-directory/uploads/images/83/83965417-e7d7-4b04-8f0c-6ced06213605.png

Method Marketing,We're an extension of your internal team. From SEO services to Social Media Management and even Web Development. We take your goals and develop an effective marketing plan specific to your needs. Our goals are to help grow your business and increase ,https://static.semrush.com/agency-directory/uploads/images/79/791c3701-7a7f-4f56-a860-ac816055b8de.png

Mind Methods,"We are a digital advertising, communications, creative and brand agency based on Sydney's Northern Beaches. We focus to understand your unique situation and implement bespoke marketing strategies and solutions in line with your business and ",https://static.semrush.com/agency-directory/uploads/images/4e/4e569b4a-476e-4ad2-a71a-eb394cab7830.jpg

Digitally Charged Ltd,"Full service digital agency providing services to the automotive industry and beyond. SEO, Programmatic, Digital Ad Design, Social Retargeting and data profiling are among our services. Our vision is to be renowned as a forward thinking, ",https://static.semrush.com/agency-directory/uploads/images/93/93e76025-5242-4ec2-97ee-d1b84725e4fa.jpg

Seek Social Limited,"Since the early days in 2015 (when the business was just two laptops on our director’s kitchen table) Seek Social has certainly grown. These days, we stand ready to use all our expertise, digital marketing knowledge, and networks to help any ",https://static.semrush.com/agency-directory/uploads/images/51/510bfa96-628b-4fe8-b4f9-21ebb81ad5be.png

Soap Media,"Soap Media is an award-winning digital marketing agency in Manchester and Preston with a high-performance track record for some of the UK's leading brands. We're a Google Premier Partner, and have been previously named as the Number One Agency for ",https://static.semrush.com/agency-directory/uploads/images/a7/a72b62a1-3309-4c8b-a635-dda77f572114.png

GoingClear,"GoingClear was founded in 2001 and continues to be the clearest way for companies and brands who want more conversions out of their digital presence & channels. Our focus is designing engaging interactive websites that are conversion focused, ",https://static.semrush.com/agency-directory/uploads/images/cf/cfe2c7d8-632e-4509-b054-18a3091e9391.png

Online Capital Group,"Online Capital Group offers professional and comprehensive online presence management solutions as well as the creation of online capital, such as professional websites and SEO strategies. They help your brand stand out from industry competitors by ",https://static.semrush.com/agency-directory/uploads/images/f9/f9446f32-b712-4ee4-8db4-596094432bf2.jpg

"The Childress Agency, Inc.","Childress Agency, a top-rated digital marketing agency located in Washington, D.C Metro Area. We have been ranked among the best web development companies and social media marketing agencies in the Greater Washington area by Expertise.com. ",https://static.semrush.com/agency-directory/uploads/images/a7/a7c8bb88-2b53-482d-b065-cc924df4ec3c.png

1SEO Digital Agency,"At 1SEO Digital Agency, we provide comprehensive digital solutions, custom-tailored for each of our clients, enabling them to both grow and protect their businesses. Even though things today bear little resemblance to what they did when we opened ",https://static.semrush.com/agency-directory/uploads/images/d8/d8520ec2-a6f8-4f5f-9971-ec28d1b72d0f.png

Streamline Results,"The main pillar of our company is simple: ""Say What You Do, and Do What You Say."" In an industry full of fly-by-nights, our main focus is to create, launch, and manage high-end digital marketing campaigns that truly bring an ROI to your business. ",https://static.semrush.com/agency-directory/uploads/images/54/541da323-8cd5-4ffe-b5cb-ec78584f9639.png

WAUW Digital Agency,"Bij ons vind je alle marketingexpertises onder één dak. Van strateeg tot designer en van marketeer tot developer. Wij verbinden strategie, online marketing, creatie en development om altijd het maximale resultaat te halen en écht impact te maken.",https://static.semrush.com/agency-directory/uploads/images/8e/8eb2cfb3-9673-4581-a69c-467f211e1b8d.jpg

Adalystic Marketing,"We know firsthand that lean marketing teams can do big things with the right tools, strategy and players. Our mission is to be an efficient extension of your team. We use a blend of data, automation and digital strategy to drive targeted growth.",https://static.semrush.com/agency-directory/uploads/images/60/60720e4f-b943-4d5e-b207-21755cff91ae.png

InterActive Circle,"InterActive Circle has been helping businesses evolve and grow since 2011. From the start, we have always helped our clients with their digital marketing and this “online” stuff.",https://static.semrush.com/agency-directory/uploads/images/df/df580807-69aa-463c-8c46-1429b13244d8.jpg

